{
  "run_id": "20260926-101500",
  "round": 0,
  "rule_file": null,
  "rule_sha256": null,
  "tests_target": [],
  "results": [
    {
      "variant_id": "v01",
      "status": "detected",
      "detected_by": [
        "tests"
      ],
      "detail": "tests failed"
    },
    {
      "variant_id": "v02",
      "status": "escaped",
      "detected_by": [],
      "detail": "tests passed"
    },
    {
      "variant_id": "v03",
      "status": "escaped",
      "detected_by": [],
      "detail": "tests passed"
    },
    {
      "variant_id": "v04",
      "status": "escaped",
      "detected_by": [],
      "detail": "tests passed"
    },
    {
      "variant_id": "v05",
      "status": "escaped",
      "detected_by": [],
      "detail": "tests passed"
    },
    {
      "variant_id": "v06",
      "status": "escaped",
      "detected_by": [],
      "detail": "tests passed"
    }
  ],
  "valid": 6,
  "detected": 1,
  "score": 0.1667,
  "recorded_at": "2026-09-26T10:21:40+00:00"
}
